{
  "apps_bundle_decrypted": false,
  "checks": {
    "all_frozen_input_hashes_match": true,
    "cryptography_dependency_available": false,
    "cryptography_version_allowed": false,
    "inventory_completed": false,
    "project_revision_matches": true,
    "tracked_worktree_clean": true,
    "wheel_is_outside_tracked_project": true,
    "wheel_path_is_absolute": true,
    "zero_network_extract_model_boundary_closed": true
  },
  "data_downloaded": false,
  "expected_project_revision": "dd1cd002674740c2ff08fcbaa590ed41e65c0c4a",
  "gpu_used": false,
  "implementation_config_sha256": "1c2fa17c9f671c60ed7a9c3a88fb2dd4913ef5c897b6b7b327367b688dff1957",
  "inventory": null,
  "model_loaded": false,
  "next_gate": "stop_apps_bundle_inventory",
  "passed": false,
  "project_revision": "dd1cd002674740c2ff08fcbaa590ed41e65c0c4a",
  "protected_plaintext_persisted": false,
  "run_kind": "proper_v2_3_appworld_aggregate_only_apps_bundle_inventory",
  "schema_version": 1,
  "source_extracted": false,
  "static_api_inventory_authorized": false,
  "stop_reason": "preflight_failed",
  "task_or_api_data_read": false,
  "tests_bundle_decrypted": false,
  "tests_bundle_read": false,
  "wheel_path": "/home/amax/proper-inputs/appworld/appworld-0.1.3.post1-py3-none-any.whl"
}
